from_id,from_name,message,created_time,type,link,id,story,likes_count,comments_count,shares_count
228389347303103,안철수,"[광주전남언론포럼 초청토론회 모두발언]
@광주 염주체육관 내 국민생활관 (2017.02.13.)

사단법인 광주·전남언론포럼 관계자 여러분들께 깊은 감사의 말씀 드립니다.

광주 전남은 제가 처음 정치를 할 때 저를 불러준 곳입니다.
제가 새정치민주연합을 나와 광야에 홀로 섰을 때 저를 따뜻하게 안아주신 곳입니다.
그리고 지난 총선에서 국민의당에 압도적 지지를 보내주신 곳입니다.

3당 체제가 만들어졌습니다.
기득권양당체제에 금이 쩍쩍 갔습니다.
여소야대가 됐습니다.
이 모두 호남유권자들께서 다시 한 번 한국 정치사의 기적을 만드신 것입니다.

그 결과, 박근혜 게이트가 더 빨리 세상에 드러나게 되었고, 234명의 압도적인 탄핵 가결이라는 성과도 만들어냈습니다.
지난 30년간 가장 빠른 국회 개원 그리고 예산 국회에서 협치를 실현할 수 있었던 것도 바로 3당체제의 힘입니다.

이곳에서 만들어주신 대한민국 정치 지형의 변화에 지금 대한민국 국민이 살고 있는 셈입니다.
싸우기만 하던 양당체제가 일하고 경쟁하는 국회로 바뀐 겁니다.

지난 청문회 과정에서 김경진 의원, 이용주 의원 등 호남의 새로운 젊은 정치인들이 스타로 발돋움했습니다.
국민의당을 지지해주신 것이 선물을 주신 것이 아니라 숙제를 주신 것이라는 것을 잘 알고 있습니다.
앞으로 더 열심히 해서 기대에 보답하겠습니다.

존경하는 광주‧전남 언론인 여러분.
지금 국민들의 요구는 세 가지입니다.
정권교체, 부패 구체제 청산 그리고 미래대비입니다.

저는 오늘 이 자리에서 굳은 약속을 드립니다.
이번에 반드시 정권교체해서 광주전남의 지지와 성원에 보답하겠습니다.
김대중 대통령과 노무현 대통령을 탄생시킨 호남의 자존심을 되찾겠습니다.
지난 대선에서 호남의 압도적 지지에도 불구하고 패배했던 역사를 반복하지 않기 위해서 저와 국민의당이 정권교체의 꿈을 기필코 이뤄내겠습니다.

이번 대선에서 확실한 것은 반드시 정권교체가 된다는 사실입니다.
정권교체를 열망하는 국민들은 안심하고 누가 더 좋은 정권교체인지 누가 진정으로 이 나라를 살릴 정권교체인지를 선택하시게 될 것입니다.

박근혜 정부와 새누리당의 실패는 계파정치 때문입니다.
계파란 끼리끼리 해먹는 것입니다.
다음 정부에서 다시 이런 일이 반복되어선 안 됩니다.
호남은 반패권의 성지입니다.
패권세력이 둥지 틀게 하는 일은 있을 수 없다고 믿습니다.

또한 지금은 산업화, 민주화, 정보화를 이미 넘어서 4차 산업혁명시대에 우리는 살고 있습니다.
정보화시대도 이끌지 못하는 사람이 4차 산업혁명시대를 이끌어 갈 수는 없습니다.

저는 과거청산과 미래대비 둘 다 자신 있습니다.

호남의 높은 정치의식을 기반으로 부패 구체제를 끝내고 전문가들과 토론하며 미래를 준비하겠습니다.
호남의 미래, 대한민국의 미래를 위해 제가 가진 모든 것을 쏟아붓겠습니다.
함께 잘 사는 대한민국 그리고 평화로운 한반도를 기필코 만들어내겠습니다.

고맙습니다.",2017-02-13T02:07:05+0000,photo,https://www.facebook.com/ahncs111/photos/a.232039820271389.1073741830.228389347303103/900815520060479/?type=3,228389347303103_900815520060479,NA,254,35,16
228389347303103,안철수,"(의원실)
안철수 전 대표 2월 15일(수) <대전/충북> 일정입니다.
‘국방과학연구소 방문’과 ‘대전지역 기자간담회’는 이곳 페이스북 페이지에서 생중계합니다.
많은 관심과 시청 바랍니다.

08:30 국립대전현충원 참배
09:20 국방과학연구소 방문 – 페이스북 라이브
10:40 대전지역 기자간담회 / 대전시청 – 페이스북 라이브
11:50 카이스트 방문, 학생들과 오찬 / 한국과학기술원 본관
14:30 충북지역 기자간담회 / 충북도청
15:00 MBC충북 인터뷰 / 충북도청
16:00 오창농협 청원친환경농산물유통센터 방문
17:10 충북지역위원장 및 핵심당직자 간담회
19:00 대전시당 부부당원 만찬회",2017-02-14T10:20:15+0000,photo,https://www.facebook.com/ahncs111/photos/a.232039820271389.1073741830.228389347303103/901619659980065/?type=3,228389347303103_901619659980065,NA,247,31,13
228389347303103,안철수,"(의원실)
이재용 경영승계를 위한 제일모직-삼성물산 합병 과정에 국민연금이 이용됐다는 의혹이 제기됐습니다.
낡은 정경유착이 아직도 우리 경제의 발목을 잡고 있습니다.
2015년 국정감사에서 이 점을 지적한 안철수 전 대표.
재벌이 장악한 불공정한 경제구조 혁신을 위해 일관되게 노력하고 있는 안철수 전 대표와 함께 해주세요!",2017-02-14T09:27:16+0000,photo,https://www.facebook.com/ahncs111/photos/a.232039820271389.1073741830.228389347303103/901596086649089/?type=3,228389347303103_901597079982323,안철수 added 7 new photos.,415,35,31
228389347303103,안철수,"“전문가들과 토론이 가능한 대통령을 가질 때가 됐지 않습니까?”

JTBC 정치부 마크맨 분들과 진행한 소셜라이브 인터뷰, 하이라이트 영상 공유합니다.

https://www.facebook.com/JTBCstandforyou/videos/656123517894152/",2017-02-14T08:41:30+0000,video,https://www.facebook.com/JTBCstandforyou/videos/656123517894152/,228389347303103_901573529984678,안철수 shared 소셜스토리 - JTBC 정치부's video.,406,35,1
228389347303103,안철수,"발렌타인데이라고 스태프들이 제가 30년 전 아내에게 썼던 러브레터로 이런 카드뉴스를 만들었네요. 공유합니다.

아내와 저는 의대 본과 3학년 때 의료봉사서클에서 처음 만났습니다. CC(캠퍼스커플)였죠.

중요한 시험기간 이었는데, 제가 시험공부를 도와주겠다고 했죠. 바로 도서관을 같이 다녔는데, 방학 땐 공부를 했는지 영화를 봤는지 헷갈립니다.

저희는 대놓고 연애를 했는데요, 그 때 제가 보낸 마음의 메모를 아내가 아직도 간직하고 있었습니다.",2017-02-14T07:38:15+0000,photo,https://www.facebook.com/ahncs111/photos/a.232039820271389.1073741830.228389347303103/901548129987218/?type=3,228389347303103_901549856653712,안철수 added 3 new photos.,577,61,29
228389347303103,안철수,"[군산 조선소 존치 범도민 총궐기대회 발언]
@군산 롯데마트 앞 (2017.02.14.)

군산 조선소는 현대중공업 열두 개 도크 중 하나의 도크로서의 의미에 그치지 않습니다.
그동안 남동권에만 집중되었던 조선업의 서해안 시대를 열었던 환서해안시대의 상징이자 군산의 자부심입니다.

군산 조선소 폐쇄는 군산과 전북 경제의 위기를 의미합니다.
대한민국 미래 조선업의 거점이 사라지는 것입니다.
전북의 경제 위기는 곧 대한민국 전체 경제 회복에 악영향을 줄 것이 분명합니다.

군산 조선소 폐쇄는 단순히 기업 경영 논리만으로 결정되어서는 안 됩니다.
조선소 폐쇄에 따른 근로자 대량 실직과 협력사 도산 등 지역 사회와 지역 경제에 미치는 영향을 반드시 고려해야 합니다.

STX조선, 대우조선해양에는 수조원의 자금을 쏟아 부어 연명시켰던 정부가, 현대중공업 군산 조선소 도크 가동 중단에는 뒷짐만 지고 있는 것은 형평성에도 맞지 않습니다.

군산 조선소 존폐 문제는 특정 지역이나 특정 정당에만 국한되는 문제가 아닙니다.
군산의 위기, 대한민국 조선업의 위기 극복을 위해 정치권 또한 합심해야 합니다.

국민의당은 어제 정부 부처와 현대중공업을 상대로 군산 조선소 폐쇄 철회를 요구할 것을 결의했습니다.
저와 국민의당은 군산 조선소 존치를 위해 총력을 집결할 것이며, 저 또한 군산 조선소 폐쇄 결정이 철회될 수 있도록 최선을 다하겠습니다.

고맙습니다.",2017-02-14T06:27:47+0000,photo,https://www.facebook.com/ahncs111/photos/a.232039820271389.1073741830.228389347303103/901516803323684/?type=3,228389347303103_901518139990217,안철수 added 2 new photos.,224,16,12
228389347303103,안철수,"(의원실)
안철수 전 대표 2월 16일(목) <충남/세종> 일정입니다.

10:00 충남지역 기자간담회 / 충남도청
11:30 한서대 항공교육시설 방문 / 태안비행장
14:00 충남 국민광장 발대식 / 르셀웨딩컨벤션 4층 (충남 서산시)
17:00 세종시 기자간담회 / 세종시청
18:00 세종시 학교운영위원장 만찬 좌담회 / 아름동주민센터",2017-02-15T10:22:50+0000,photo,https://www.facebook.com/ahncs111/photos/a.232039820271389.1073741830.228389347303103/902273206581377/?type=3,228389347303103_902273206581377,NA,226,42,12
228389347303103,안철수,"(의원실)
Q : 취임 후 안철수의 첫 대북 메시지는?
A : ""정은아, OOOOO!""
오늘밤 2월 15일(수) 11시 10분,
SBS <대선주자 국민면접>에서 직접 확인하세요!",2017-02-15T09:36:24+0000,photo,https://www.facebook.com/ahncs111/photos/a.232039820271389.1073741830.228389347303103/902249916583706/?type=3,228389347303103_902249916583706,NA,358,72,11
228389347303103,안철수,"대통령 면접 보고 왔습니다.
국민들께서 SNS를 통해 보내주신 촌철살인의 질문에 답하느라 혼을 뺐습니다.
기를 쓰고 제 역량을 검증하기 위해 모인 패널들의 압박질문도 받아냈습니다.
제가 어떻게 면접을 통과했을지 궁금하신가요?
오늘밤 11시 10분, SBS <대선주자 국민면접>에서 뵙겠습니다.
https://goo.gl/EFAHex",2017-02-15T08:02:22+0000,link,https://goo.gl/EFAHex,228389347303103_902218709920160,NA,1286,170,80
228389347303103,안철수,"[충북지역 기자간담회 모두발언]
@충북도청 (2017.02.15.)

반갑습니다. 안철수입니다.
2박 3일 일정으로 열심히 이곳을 찾아뵙고 말씀드리고 있습니다.
바쁘신 중에도 참석해주신 충북 언론인 여러분들께 다시 한 번 더 진심으로 감사의 말씀 드립니다.

지난 13일이었습니다.
충북 보은의 한우 농장 2곳에서 추가로 발견된 구제역 의심축이 모두 양성으로 확인됐습니다.

지난 5일입니다.
처음 구제역 발생한 이후에 지금까지 발생한 농가가 보은 7곳, 전국적으로는 9곳으로 늘어났다는 것을 보고, 11일 그 지역 재난안전대책본부를 찾았습니다.

정부가 어떤 수단과 자원을 동원하더라도 전국 확산을 방지하고, 근본적인 해결을 하겠다는 각오로 강하게 임할 것을 촉구했습니다.
그리고 저 나름대로 세 가지 중요한 제안들을 했습니다.
그런데 그 후에 또다시 충북 보은에서 구제역이 발생했습니다.

특히 충북 보은에서 계속 구제역이 발생하는 것은 축산 농가의 집적화 때문입니다.
관리의 효율성 때문에 축산 농가를 밀집시킨 것이 오히려 독이 됐습니다.
이제 집적화된 축산 농가의 특성을 고려해서 방역을 더 철저하되 장기적으로는 집적화를 줄이면서도 축산 관리를 효율화할 수 있는 방안을 찾아서 추진해나가야 하겠습니다.

다시 한 번 정부의 철저한 방역을 촉구하고, 구제역으로 인한 피해 농가에 대한 대책 마련 그리고 구제역 후폭풍에 따른 불안심리로 소비위축이 일어나지 않도록 선제적으로 대비할 것을 당부합니다.

이런 방역 등을 비롯해서 재해와 재난에 대비하고, 국민 한 사람 한 사람의 생명과 안전, 재산을 최우선으로 하는 것이 국가안보여야 합니다.
국가는 국가안보가 확립이 될 때 비로소 국민들의 꿈과 행복, 고용과 복지도 의미가 있는 겁니다.
그래서 저는 조금 전에 대전에서 안보공약으로 자강안보를 발표한 바 있습니다.

이 자리에서도 제가 간략하게 소개 말씀을 드리자면, 북한의 미사일 발사 등 도발과 함께 한반도 긴장이 고조되고 있습니다.
지금 안보상황이 유동적이고 불확실하지만, 국력을 바탕으로 할 수 있다는 자강의지가 있으면 어떤 도전도 이겨낼 수 있습니다.

우리 대한민국을 우리 힘으로 온전히 지키는 안보를 만드는 것이 바로 자강안보입니다.
강력한 자강안보만이 한반도에서 전쟁 위협을 억제할 수 있습니다.
강력한 자강안보만이 한반도 비핵화를 이루고 평화로운 한반도를 만들 수 있습니다.

힘과 외교는 바늘과 실의 관계입니다.
강력한 국방력이 있어야지 대화의 테이블에서 강해질 수 있는 것 아니겠습니까.
자강안보로 확실한 대북우위의 군사력을 만들겠습니다.
이와 함께 굳건한 한미동맹을 토대로 국제사회와의 긴밀한 공조와 협력으로 안보위기를 극복하겠습니다.

안보에 여야가 없습니다.
진보-보수도 없습니다.
대한민국의 기본을 지키는 일이기 때문입니다.
기본을 사수하고 평화로운 한반도를 만들기 위해서 국론의 통합과 초당적 대처가 필요합니다.
충북 도민 여러분은 물론, 국민적으로 통합된 하나의 힘으로 자강안보를 만들어 가겠습니다.

안보는 물론 지방분권으로 충북과 함께 하겠습니다.
지금까지 대한민국 전체예산의 그리고 인력의 80% 자원을 중앙이 틀어쥐고 배분을 왜곡시켜 왔습니다.
충북이 잘할 수 있는 일에 선택과 집중을 하려면 중앙정부의 권한을 지방에 이양해야 충북이 크고 결국 대한민국 전체가 발전할 수 있습니다.

먼저 충북이 발전하기 위해서는 국가 X축 교통망 조기 구축으로 서울과 수도권에 집중된 물적‧인적 자원을 분산시키는 허브가 되어야 합니다.
물류, 교통의 신성장축을 충북에 마련함으로써, 충북의 발전은 물론 국가균형발전의 교두보가 되도록 하는 것입니다.

다음으로, 미래 생명과학산업에 대비해 생명과학 인프라 수준을 높여야 합니다.
개인적으로 지난 19대 국회 전반기-하반기 내내 보건복지위원으로서 계속 관심을 가지고 충북 오송을 찾은 바 있습니다.
충북 오송은 국내 최적의 인프라가 있습니다.
따라서 바이오헬스케어 복합도시로 발전시키는 것이 다음 단계가 되어야 합니다.
이를 통해 생명과학 분야에서 세계적인 경쟁력을 확보하도록 해야 할 것입니다.

4차 산업혁명 이야기가 많이 나옵니다만, 보통 IT기술에 많은 관심들을 두고 있습니다.
그와 함께 중요한 축이 생명과학 분야입니다.

저는 개인적으로 의과대학에서 박사학위를 생명과학분야에서 연구하고 받았습니다.
관심은 물론이고 전문지식도 가지고 있습니다.
지난 19대 국회 때 보건복지위원을 하면서 열심히 현황을 파악하고 있다고 생각합니다.

그것을 기반으로 이곳에서 수많은 창업이 이뤄지고, 세계적인 기업이 나오고, 충북의 청년들의 일자리를 만들어 낼 수 있다고 믿습니다.

지난 20년 간 우리는 정보화를 성공적으로 이루고 20년간 먹고 살 수 있었습니다.
그러나 이제 한계에 부딪쳤습니다.
이제는 4차 산업혁명시대입니다.
저는 4차 산업혁명을 계기로 앞으로 20년 미래 먹거리, 만들겠습니다.

고맙습니다.",2017-02-15T07:04:28+0000,photo,https://www.facebook.com/ahncs111/photos/a.232039820271389.1073741830.228389347303103/902174959924535/?type=3,228389347303103_902182916590406,안철수 added 2 new photos.,254,20,8
228389347303103,안철수,"[의원실]
오늘밤 11시10분 'SBS 대선주자 국민면접'에 드디어 안철수 전 대표가 출연합니다.
장장 5시간의 녹화가 어떤 편집본이 되어 나올지 참 궁금합니다.

방송 기다리시는 분들 지루하지 마시라고 퀴즈 하나 드립니다.
녹화장에서 ""취임 후 첫 대북메시지는 무엇으로 할 것인가?""라는 한 패널의 질문에 안철수 전 대표의 대답은 바로

""정은아, ㅇㅇㅇㅇㅇ!""였습니다.

이 다섯 글자는 과연 무엇일까요?

정답은 방송에서 함께 확인하시죠.^^
(설마 편집되진 않았겠죠..? ㅎㅎ)",2017-02-15T05:13:04+0000,photo,https://www.facebook.com/ahncs111/photos/a.232039820271389.1073741830.228389347303103/902137906594907/?type=3,228389347303103_902137906594907,NA,294,44,21
