from_id,from_name,message,created_time,type,link,id,story,likes_count,comments_count,shares_count
228389347303103,안철수,"투표는 승리입니다.
투표는 개혁입니다.
투표는 통합입니다.
투표는 미래입니다!

저 안철수에게 압도적 지지를 보내주십시오!
반드시, 기필코 대선승리로 보답하겠습니다.",2017-03-26T08:30:15+0000,video,https://www.facebook.com/ahncs111/videos/929994603809237/,228389347303103_929994603809237,NA,755,62,44
228389347303103,안철수,"국민의당이 대선에서 압도적으로 이겨 정권교체 꼭 해달라는 호남과 제주 시민들의 뜨거운 의지와 요구를 확인했습니다.
대선에서 반드시 승리해 보답하겠습니다.
'광주·전남·제주' 후보연설, 머니투데이 영상입니다.
https://youtu.be/vcW59nqSb1I",2017-03-26T07:41:34+0000,video,https://youtu.be/vcW59nqSb1I,228389347303103_929973780477986,NA,575,35,23
228389347303103,안철수,"[국민의당 전국순회경선 ‘전북’ 후보연설 전문]
@전북 전주실내체육관 (2017.03.26.)

사랑하는 당원동지 여러분!
존경하는 전북도민 여러분!
반갑습니다!
기호 1번 안철수입니다.

어제 광주, 전남, 제주 경선에 정말 많은 분들이 참여해 주셨습니다.
여론조사에 잡히지 않았던 민심이 총선열풍처럼 쏟아져 나왔습니다.
국민의당은 정당사상 처음 치러진 현장투표를 공정하게 처리했습니다.
감사합니다. 진심으로 고맙습니다.
국민의당 중심으로 정권교체를 하라는 뜨거운 의지 확인했습니다.
여기 계신 손학규 후보, 박주선 후보와 함께 반드시 대선에서 승리하겠습니다.

사랑하는 전북도민 여러분!

세월호가 인양됐습니다.
녹슨 선체의 모습을 보면서,
또 다시 가슴이 미어졌습니다.
도대체 왜 3년이나 걸린 것입니까?
이게 나라입니까?
제대로 된 국가 새로 만들어야 합니다.
저 안철수가 새로운 대한민국 반드시 만들겠습니다.

뿌리까지 썩은 나라, 바꿔야 합니다.
낡은 과거와 결별하고, 미래로 나아가야 합니다.
산업화, 민주화 시대를 넘어 새로운 미래, 열어야 합니다.
누가 할 수 있습니까?

미래는 기다리는 것이 아닙니다.
미래는 만들어가는 것입니다.
농업의 미래도 제가 책임지겠습니다.
4차 산업혁명시대에 농업을 식품산업으로 거듭나게 하겠습니다.
식량 자급률 높이겠습니다.
사람이 떠나는 농촌이 아니라 사람이 모이는 농촌 만들겠습니다.
이 담대한 도전의 적임자, 과연 누구입니까?

대신할 수 없는 미래, 저 안철수가 해내겠습니다.
분명히 약속드립니다.
문재인을 꺾고 반드시 승리하겠습니다.
문재인을 이길 수 있는 사람, 저 안철수가,
대한민국의 미래를 여는 첫 번째 대통령이 되겠습니다.

전북도민 여러분, 함께 해주시겠습니까?
전북도민 여러분이 원하시는 대로,
저 안철수가 반드시 대통령이 되어 돌아오겠습니다. 여러분!

전북은 지난 총선에서 압도적 지지로 국민의당을 세워주셨습니다.
민주당을 꺾고 전국 지지율 제1야당이 되었습니다.
민주당에서 국민의당이 호남당이라고 비아냥거릴 때
당당하게 녹색 깃발 들고,
새누리당 확장, 막아냈습니다.
민주당은 새누리당이 180석 할 것이라며, 국민의당을 분열세력이라고 했습니다.
하지만 저 안철수, 좌절하지 않았습니다.
더 강력하게 도전했습니다.
국민의당이 나오자 새누리 과반이 무너지고 결국 해체되었습니다.

3당체제 만든 당, 여소야대 만든 당, 어느 당입니까?
정권교체는 이미 확정되었습니다.
마음에 들지 않지만 이길 수 있는 후보 선택할 필요 없습니다.
마음에 드는 후보 선택하면 더 좋은 정권교체 됩니다. 동의하십니까?
수구가 아닌 개혁 선택해야 합니다.
기득권 아닌 혁신 선택해야 합니다.
과거가 아닌 미래 선택해야 합니다.

다시는 이 나라를 패권주의 세력에게 맡길 수 없습니다.
문재인 후보는 이제와서 호남에 대한 인사차별, 예산차별을 인정했습니다.
지난 총선 때 표를 얻기 위해서 했던 정계은퇴 약속도 지키지 않았습니다.
선거 때만 호남의 지지를 얻으려는 사람을 뽑아서는 안됩니다.
한 번 속으면 실수지만 두 번 속으면 바보입니다.

문재인을 이길 도전자, 누구입니까?
문재인을 이길 개혁가, 누구입니까?
문재인을 이길 혁신가, 누구입니까?

제가 정치를 처음 시작했을 때도,
광야에서 혈혈단신 국민의당을 만들었을 때도,
저를 가장 따뜻하게 안아주시고 지지해주신 곳이 바로 호남입니다.

보답하겠습니다.
기필코, 대선에서 승리하겠습니다.
전북의 자존심 되찾고, 대한민국 새롭게 바꾸겠습니다.

저는 일관되게, 국민의당 중심의 정권교체 주장해왔습니다.
국민의당을 믿어야 합니다.
우리 스스로 할 수 있다고 믿어야, 국민께서도 믿어주십니다.

지금 이 나라를 이끄는 것도 정치를 이끄는 것도 오직 국민들이십니다.
오직 국민을 믿고, 국민의당을 믿고,
단결해서 전진할 때만이 대선에서 승리할 수 있습니다.
국민에 의한 연대만이, 진정한 승리의 길입니다.

패권주의에 반대해온 호남의 통합정신이
국민에 의한 연대를 이끌 것입니다.
수구세력에 맞서 싸워온 호남의 개혁정신이
대한민국을 새롭게 바꿀 것입니다.

저 안철수, 감히 말씀드립니다.

승리를 생각해도 저 안철수입니다.
개혁을 생각해도 저 안철수입니다.
통합을 생각해도 저 안철수입니다.
미래를 생각해도 저 안철수입니다.
전북을 생각해도 저 안철수입니다.

압도적 지지를 보내주십시오!
반드시, 기필코! 대선승리로 보답하겠습니다.

고맙습니다.",2017-03-26T05:53:47+0000,photo,https://www.facebook.com/ahncs111/photos/a.232039820271389.1073741830.228389347303103/929909387151092/?type=3,228389347303103_929910300484334,안철수 added 2 new photos.,272,28,11
228389347303103,안철수,"(의원실)
안철수 후보 3월26일(일) 추가 일정입니다.

16:00 국립 대전 현충원 참배 / 대전 유성구",2017-03-26T05:33:10+0000,status,NA,228389347303103_929899780485386,NA,146,13,4
228389347303103,안철수,"안철수, 국민의당 전국순회경선 ‘전북’ 후보연설 (생방송, 전주실내체육관)",2017-03-26T04:43:51+0000,video,https://www.facebook.com/ahncs111/videos/929860437155987/,228389347303103_929860437155987,안철수 was live.,597,647,59
228389347303103,안철수,"국민들께서 누가 더 좋은 정권교체인지, 누가 문재인을 이길 후보인지 선택해 주실 것입니다.
전북일보 인터뷰 공유합니다.
https://goo.gl/pQVyLp",2017-03-26T03:36:45+0000,link,https://goo.gl/pQVyLp,228389347303103_929817183826979,NA,596,42,26
228389347303103,안철수,"투표가 승리입니다.
투표가 미래입니다.
대신할 수 없는 미래, 저 안철수와 함께해주십시오!",2017-03-26T03:36:26+0000,video,https://www.facebook.com/ahncs111/videos/929814763827221/,228389347303103_929814763827221,NA,852,58,44
228389347303103,안철수,"어제 광주, 전남, 제주에서 정말 많은 분들이 투표에 참여하셨습니다.
오늘은 전북에서 그 열기를 이어가주십시오!",2017-03-26T01:24:26+0000,photo,https://www.facebook.com/ahncs111/photos/a.232039820271389.1073741830.228389347303103/929745630500801/?type=3,228389347303103_929745630500801,NA,417,43,20
228389347303103,안철수,"(의원실)
안철수 후보 3월28일(화) <부산·경북> 일정입니다.

09:00 부산 북구 구포재래시장 방문

10:30 센텀시티 IT창업가 간담회 / 웹스빌딩 (부산 해운대구)

13:05 전국순회경선 유세장 당원 인사 / 부산 벡스코 (부산 해운대구)

13:30 전국순회경선 후보 연설 / 부산 벡스코 (부산 해운대구)
※페이스북에서 생중계합니다. 많은 관심과 시청 바랍니다.

17:00 현대제철 방문 / 경북 포항시

18:00 죽도시장 방문 / 경북 포항시",2017-03-27T12:30:41+0000,photo,https://www.facebook.com/ahncs111/photos/a.232039820271389.1073741830.228389347303103/930860150389349/?type=3,228389347303103_930860150389349,NA,234,57,10
228389347303103,안철수,"내일부터 부산, 울산, 경남에서 국민의당 대선후보 경선 현장투표가 진행됩니다.

투표가 개혁입니다!
투표가 경제입니다!
투표가 안보입니다!

문재인이 가장 두려워하는 후보, 바로 저 안철수입니다!

내일 부산에서 뵙겠습니다.",2017-03-27T08:55:25+0000,video,https://www.facebook.com/ahncs111/videos/930749277067103/,228389347303103_930749277067103,NA,744,103,57
228389347303103,안철수,"“아이들이 정신적으로, 신체적으로 건강하게 자랄 수 있는 방향으로 교육환경이 개선되었으면 하는 바람입니다.”
청소년 교육환경 개선에 관심이 많은 제 아내 김미경 교수의 월간 여성지 퀸과의 인터뷰 공유합니다.
https://goo.gl/nIWlOk",2017-03-27T06:12:38+0000,link,https://goo.gl/nIWlOk,228389347303103_930655920409772,NA,896,65,86
228389347303103,안철수,"저는 국민의당 중심으로 정권교체하라는, 문재인을 이기라는 호남의 명령을 기필코 완수하겠습니다.
다음 경선은 28일 부산·울산·경남입니다.
호남의 바람을 안고 끝까지 최선을 다하겠습니다.
부산일보 인터뷰입니다.
https://goo.gl/gsG10q",2017-03-27T04:24:24+0000,link,https://goo.gl/gsG10q,228389347303103_930593167082714,NA,689,73,25
228389347303103,안철수,"(의원실)
“제19대 대통령선거후보자 선출 전국순회경선”
3월 28일(화) <부산·울산·경남> 투표소 안내드립니다.

19세 이상 대한민국 국민 누구나 신분증만 지참하시면 전국 어디서든 지정된 투표소에서 투표 가능합니다!
투표 시간은 오전 9시부터 오후 6시까지입니다.

대선승리, 아무리 생각해도 안철수!",2017-03-27T03:41:34+0000,photo,https://www.facebook.com/ahncs111/photos/a.232039820271389.1073741830.228389347303103/930575130417851/?type=3,228389347303103_930575130417851,NA,232,24,19
228389347303103,안철수,"국민이 원하는 것은 진실과 사과다.
유감스럽게도 그동안 둘 다 이루어지지 않았다.
검찰은 오직 국민과 법만 보고 수사해야 한다.
박근혜 전 대통령이 혐의를 부인하고 진실을 숨기려 한다면 검찰과 법원은 국민이 진실을 알 수 있도록 할 의무가 있다.
구속영장 청구는 박근혜 전 대통령이 자초한 일이다.",2017-03-27T03:01:22+0000,status,NA,228389347303103_930559040419460,NA,583,55,19
228389347303103,안철수,"(의원실)
안철수 후보 3월29일(수) <대구·경북> 일정입니다.

09:20 안동신시장 방문 / 경북 안동시

10:45 소백쇼핑몰 방문 / 경북 영주시

11:40 예천 순흥안씨 문중종회 / 예천 웨딩의전당 (경북 예천군)

16:10 대한노인회 대구연합회 회장단 면담 / 대구 달서구

19:10 대구 동성로 방문, 대구백화점 앞 / 대구 중구",2017-03-28T12:39:08+0000,photo,https://www.facebook.com/ahncs111/photos/a.232039820271389.1073741830.228389347303103/931616373647060/?type=3,228389347303103_931616373647060,NA,283,70,9
228389347303103,안철수,"평일인데도 불구하고 많은 시민들이 투표에 참여해 주셨습니다.
고향인 부산·울산·경남 시민들께서 뜨거운 지지를 보내주셨습니다.
진심으로 감사드립니다.

호남에 이은 부산·울산·경남의 지지가 대선 승리의 밑거름이 될 것이라 확신합니다.
대구와 경북, 강원과 수도권, 충청에서도 최선을 다하겠습니다.
국민의당 중심의 정권교체, 저 안철수의 대선승리로 보답하겠습니다.",2017-03-28T11:13:28+0000,status,NA,228389347303103_931569026985128,NA,529,74,15
228389347303103,안철수,"[센텀시티 IT 창업가 간담회 모두발언]
@부산 해운대구 웹스빌딩 (2017.03.28.)

바깥을 보니 꽃이 피기 시작했어요.
봄이 오는구나, 겨울이 스스로 물러가는 게 아니거든요. 봄이 와서 겨울이 물러가는 것 아닌가요.
바깥을 보면서 이제 드디어 우리나라 계절도 바뀌겠구나 싶습니다.

여기 계신 분들 만날 생각하면서 보다 보니 저도 처음 시작할 때 생각이 났습니다.
1995년이니까 22년 전인데 그때 처음 안철수연구소 지금 안랩 창업을 했습니다.
근데 그게 사업을 하고 싶다는 것 보다 어떻게 보면 의사는 저 말고도 많은데 컴퓨터 바이러스 백신 만드는 사람은 없던 시절이라 일종의 사명감으로 나왔습니다.
저를 더 필요로 하는 곳이 어디일까 고민 끝에 의사 버리고 시작한 게 처음 창업이었는데 문제는 회사 일 안 해보고 경영이 뭔지도 모르고 조직 관리도 한 번도 해본 적 없는 사람이 회사를 처음 창업하니까 그게 됐겠습니까. 처음에 정말 고생 많이 했어요.
아마 지금 제 경력만 보시면 저 사람은 하는 것마다 쉽게 되는구나 잘못알고 계실 텐데요. 저는 처음에 창업하고 나서 거의 4년 내내 엄청나게 고생했습니다.
계속 은행에 돈 꾸러 다니는 게 일이었어요. 한 달만 은행가서 돈 안 꿔봤으면 좋겠다 싶을 정도였어요.
가는 게 정말 싫었는데 직원 월급날이 됐는데 돈은 없으니까 할 수 없잖아요. 그러니까 은행 입구에 너무너무 들어가기 싫은데 가서 돈 꾸러 다니는 그 일을 4년 내내 했습니다.
 
어느 정도였냐면, 저희 회사에 보험 외판원 한 분이 찾아왔어요.
워낙 수완이 좋아서 직원 30명 정도였을 때인데 그 보험에 거의 다 가입했어요.
그런데 저만 안했습니다. 전 직원 중에서 저만 안했어요. 왜 저는 안했냐, 아무리 고민 해봐도 1년 후에 보험료 낼 자신이 없었어요.
망할 가능성이 더 많다고 생각했거든요.
근데 그 말을 직원들한테 할 수도 없잖아요. 다 달아날까봐 저 혼자 고생, 고생 했습니다.

그러다가 창업한지 만2년이 되던 해 IMF가 터졌어요.
그때 회사가 매출을 한 5억 정도 할 때인데 한라그룹이라는 굉장히 큰 그룹에 엄청나게 큰 규모의 납품을 한 거예요.
제 기억에 아마 한 2억 정도 됐었나, 그러니까 연매출 거의 절반 가까운 거 아닙니까. 그런데 부도나는 바람에 그 돈을 한 푼도 못 받은 거예요.
그 절망감, 도대체 국가가 부도 위기에 내몰렸는데 이 조그마한 조각배 타고 태평양에서 폭풍 만난 그 기분 아실 거예요. 회사 부도 소식 접하고 너무 낙심해서, 정말 한 푼도 못 받았어요.
다행히 소프트웨어니까 괜찮지 하드웨어 납품했으면 바로 망했을 거예요.
너무 낙담해서 회사에 들어 와보니 직원들이 다 자기 일 하느라고 바쁜 거예요. 책상에 얼굴 대고 아무도 저를 안보니까 안심하고 재빨리 제 방에 들어갔어요.
그런데 몇 시간 있다가 보니 회사가 완전 초상집처럼 된 겁니다. 그래서 그때 알았어요. 전부 다 안보는 척 하면서 저를 쳐다보고 있었다는 것을. 항상 저를 쳐다보고 있었다는 것을.

그러니까 어떤 조직의 리더가 그렇게 중요하구나, 조직을 맡은 리더는 무대 위에 선 배우라고 생각해야 되는구나, 모든 사람들이 다 쳐다보고 있는구나라는 것을 알았어요.
직원이 무슨 죄입니까. 회사 어려우면 사장이 고민해야지 직원들 고민시키는 건 아니거든요.
그 다음부터는 정말 안 좋은 일 있었을 때도 회사 문 열기 전에 항상 제 머릿속에 스위치를 바꾸고 묶고 들어갔어요. 직원들 걱정 안시키려고.
그러면서 이제 하나, 하나 견뎌가게 됐어요.

그러다보니 제가 습관적으로 제 감정표현을 잘 안하는 사람이 됐습니다. 직원들 걱정 안 시키려고. 그랬던 옛날 일들이 많이 떠오르네요. 그래서 4년 동안 은행가서 어음깡하면서.

제가 정치하면서 다른 정치인들한테 농담처럼 이야기합니다. 어음깡 한 번 안 해본 사람은 정치하는 거 곤란한 거 아니냐고 그럽니다.
중소기업 사장님이 정치인들보다 훨씬 더 힘들고 어려운 경험들을 많이 한다고 그러고 있습니다만, 오늘은 제 이야기만 하기보다 여러분들 가진 고민들 듣고 제가 22년 전 창업할 때와 어떤 점이 나아지고 어떤 점이 열악해졌는지 그런 이야기 꼭 듣고 싶어서 왔습니다.

시간 내주셔서 감사합니다.",2017-03-28T10:39:57+0000,photo,https://www.facebook.com/ahncs111/photos/a.232039820271389.1073741830.228389347303103/931551580320206/?type=3,228389347303103_931552130320151,안철수 added 2 new photos.,294,38,19
228389347303103,안철수,"(의원실)
안철수 국민캠프 자원봉사단 홈페이지 <안철수와 국민요정들>이 오픈했습니다.
<안철수와 국민요정들>은 국민들이 직접 참여하고 운영하는 ‘개방형 대선캠프’입니다.
누구나 국민 제안과 정책 개발에 손쉽게 참여할 수 있는 소통 통로입니다.
자원봉사단에 참여하고 싶은 분은 홈페이지 내 지원 버튼을 클릭하고 이름, 생년월일 등 간단한 정보를 기입하면 됩니다.

특히 눈길을 끄는 점은 ‘반응형 웹기술’입니다.
사용자의 디바이스를 감지해 PC, 태블릿PC, 모바일 등 다양한 기기에서 동일한 콘텐츠를 제공하는 기술입니다.
안철수 후보의 IT 전문성이 돋보이는 대목으로, 사용자의 접근성을 획기적으로 향상시켰습니다.

<안철수와 국민요정들>은 국민이 참여하는 개방형 캠프로, 질 좋은 대선 공약을 발굴하는 계기도 될 것입니다.
<안철수와 국민요정들>의 URL주소는 http://ahn1004.net 로, 안철수 후보의 SNS와 연동돼 실시간으로 콘텐츠를 공유할 수 있습니다.

<안철수와 국민요정들>에 많은 참여와 관심 바랍니다.",2017-03-28T09:37:00+0000,link,http://ahn1004.net/,228389347303103_931518853656812,NA,368,44,24
228389347303103,안철수,"지금 부산, 울산, 경남에서 국민의당 대선후보 경선 현장투표가 진행되고 있습니다.
투표가 미래입니다!
많은 투표 참여 부탁드립니다.

미래를 생각해도 저 안철수입니다.",2017-03-28T08:39:01+0000,photo,https://www.facebook.com/ahncs111/photos/a.232039820271389.1073741830.228389347303103/931489806993050/?type=3,228389347303103_931489806993050,NA,204,18,11
228389347303103,안철수,"지금 부산, 울산, 경남에서 국민의당 대선후보 경선 현장투표가 진행되고 있습니다.
투표가 미래입니다!
많은 투표 참여 부탁드립니다.

개혁을 생각해도 저 안철수입니다.",2017-03-28T07:27:51+0000,photo,https://www.facebook.com/ahncs111/photos/a.232039820271389.1073741830.228389347303103/931460910329273/?type=3,228389347303103_931460910329273,NA,178,10,14
228389347303103,안철수,"지금 부산, 울산, 경남에서 국민의당 대선후보 경선 현장투표가 진행되고 있습니다.
투표가 미래입니다!
많은 투표 참여 부탁드립니다.

경제를 생각해도 저 안철수입니다.",2017-03-28T06:46:21+0000,photo,https://www.facebook.com/ahncs111/photos/a.232039820271389.1073741830.228389347303103/931436256998405/?type=3,228389347303103_931436256998405,NA,217,12,16
228389347303103,안철수,"[국민의당 전국순회경선 ‘부산·울산·경남’ 후보 연설 전문]
@부산 벡스코 (2017.03.28.)

사랑하는 당원동지 여러분!
존경하는 부산, 울산시민과 경남도민 여러분!
반갑습니다!
국민의당 기호 1번 안철수입니다.

국민의당 경선 정말 뜨겁습니다.
여론조사에 잡히지 않았던 민심이 총선열풍처럼 쏟아져 나오고 있습니다.

뿌리까지 썩은 나라, 제대로 바꾸라는 국민의 명령입니다.
부패세력 청산하고 대한민국 바로 세우라는 요구입니다.
낡은 과거와 결별하고, 미래로 나아가려는 열망입니다.
산업화, 민주화 시대를 넘어, 새로운 미래 활짝 열어야 합니다!
국민열망 이뤄낼 적임자 과연 누구입니까?

지금 대한민국은 큰 위기입니다.
경제, 안보 모두 위기입니다.
반드시 유능한 지도자 뽑아야 합니다.
경제 살려내고, 안보 튼튼히 할 대통령 뽑아야 합니다.

저 안철수, 분명히 약속드립니다.
재벌이 장악한 불공정한 경제구조, 확 뜯어고치겠습니다.
20년 미래 먹거리 확실하게 준비하겠습니다.
함께 잘사는 정의로운 대한민국 꼭 만들겠습니다.
서민들의 무거운 짐 덜어드리겠습니다.
위대한 대한민국, 다시 꿈꾸게 할 지도자 누구입니까?

북핵 위협, 계속된 도발 두고만 볼 수 없습니다.
튼튼한 자강안보로 평화 지켜야 합니다.
안보는 국가의 근본이자 뿌리입니다.
강력한 국방, 굳건한 한미동맹으로 실현하겠습니다.
방산비리, 병역비리 완전히 뿌리뽑겠습니다.
자강안보로 전쟁위험 없애고
평화로운 한반도 만들 적임자 누구입니까?

우리 부산, 울산 ,경남은 제조업의 메카입니다.
대한민국 경제의 엔진입니다.
그런데 그 경제엔진이 꺼져가고 있습니다.
조선, 해운업의 위기는 대한민국의 위기입니다.
대한민국 경제엔진, 다시 살려내겠습니다.
부울경이 살아나야 대한민국이 살아납니다.
항구도시의 대범함으로, 파도를 이겨내는 기상으로,
저 안철수, 부울경의 발전, 대한민국의 미래 활짝 열겠습니다.

부울경을 미래형 산업구조로 바꾸겠습니다.
4차 산업혁명 시대, 새로운 부가가치 창출의 허브로 만들겠습니다.

미래는 기다리는 것이 아닙니다.
미래는 만들어가는 것입니다.
미래를 여는 첫 번째 대통령 되겠습니다.

대신할 수 없는 미래, 저 안철수가 해내겠습니다. 여러분!

지난 총선 때 국민의당은 민주당을 꺾고 전국지지율 제1야당이 됐습니다.
부울경에서도 크게 지지해 주셨습니다.
저 안철수, 기득권 양당체제 깨부수기 위해 전국을 돌면서 강력하게 도전했습니다.

3당체제 만든 당, 여소야대 만든 당, 어느 당입니까?

정권교체는 이미 확정됐습니다.
국민의당 중심의 정권교체 이미 시작되었습니다.
여기 계신 손학규 후보, 박주선 후보와 함께 정권교체 하겠습니다.
함께 국정을 이끌어 가겠습니다.
이제는 더 좋은 정권교체를 선택할 때입니다.
마음에 드는 후보 선택하면 더 좋은 정권교체 됩니다. 동의하십니까?

우리 이 나라를 또 다시 계파 패권주의 세력에게 맡길 수 없습니다.
선거 때만 지지 얻으려는 사람 뽑아서는 안됩니다.
한번 속으면 실수지만 두 번 속으면 바보입니다.

문재인을 이길 승부사, 누굽니까?
문재인을 이길 개혁가, 누굽니까?
문재인을 이길 혁신가, 누굽니까?
문재인이 가장 두려워하는 후보, 누굽니까?

저는 일관되게, 국민의당 중심의 정권교체를 주장해왔습니다.
국민의당을 믿어야 합니다.
우리 스스로를 믿어야, 국민들도 믿어주십니다.
오직 국민을 믿고, 국민의당을 믿고,
전진할 때 대선에서 승리할 수 있습니다.
국민에 의한 연대, 오직 그 길만이 진정한 승리의 길입니다.

저 안철수, 감히 말씀드립니다.

안보를 생각해도 저 안철수입니다.
경제를 생각해도 저 안철수입니다.
개혁을 생각해도 저 안철수입니다.
통합을 생각해도 저 안철수입니다.
미래를 생각해도 저 안철수입니다.

단디, 단디하겠습니더. 화끈하게 밀어주이소!
반드시, 기필코! 대선승리로 보답하겠습니다.
고맙습니다.",2017-03-28T06:00:04+0000,photo,https://www.facebook.com/ahncs111/photos/a.232039820271389.1073741830.228389347303103/931413777000653/?type=3,228389347303103_931414603667237,안철수 added 3 new photos.,287,21,15
228389347303103,안철수,"(의원실)
국민의당 선관위 결정사항 안내드립니다.
국민의당 전국순회경선 ‘부산·울산·경남’, ‘대구·경북·강원’ 지역의 경우 기존 오후 6시까지였던 투표시간을 오후 7시까지 연장하기로 하였습니다.
현장투표 가능 시간 : 09:00 ~ 19:00",2017-03-28T05:40:46+0000,status,NA,228389347303103_931406523668045,NA,175,14,7
228389347303103,안철수,"안철수, 국민의당 전국순회경선 ‘부산·울산·경남’ 후보 연설 (생방송, 부산 벡스코)",2017-03-28T05:15:11+0000,video,https://www.facebook.com/ahncs111/videos/931368340338530/,228389347303103_931368340338530,안철수 was live.,560,374,52
