from_id,from_name,message,created_time,type,link,id,story,likes_count,comments_count,shares_count
228389347303103,안철수,"[직능경제인단체총연합회 정책간담회 모두발언]
@직능경제인단체총연합회 대회의실 (2017.03.03.)

현장에서 정말 중요한 여러 가지 일을 하시는 대표자분들 이렇게 귀중한 기회에 만나 뵙게 돼서 큰 영광으로 생각합니다.

지금 대한민국이 엄청난 위기상황입니다.
저는 지금 대한민국이 처해있는 상황을 5대 절벽의 낭떠러지 끝에 서있다고 표현한 적이 있습니다.

우선, 수출절벽이 우리 앞에 놓여져 있습니다.
지난 58년간 처음으로 두해 연속 수출이 감소하고 있습니다.

또 내수절벽이 있습니다.
지금 작년 연말로 가계부채가 1344조입니다.
GDP 90%가 넘고 2008년 미국금융위기 때보다 더 심각한 상황입니다.
빚이 많으니까 어떻게 물건을 더 살 수가 있겠습니까.

그리고 세 번째로는 일자리절벽입니다.
특히 청년 실업문제가 정말 심각합니다.
작년 연말에 청년 실업률이 사상최대인 9.8%를 기록했습니다.
그런데 실제 실업상태에 놓여져 있는 청년들은 34%에 이른다는 정부의 연구결과도 나왔습니다.
더 큰 문제는 이 문제가 더 심각해질 거라는 점입니다.

2010년에 대학 입학생수가 35만 명을 넘었습니다.
2012년에 사상최대 37만 명이 넘었습니다.
그런데 보통 대학 입학 이후에 여학생은 5년, 남학생은 7년 뒤 취업현장에 나오게 됩니다.
그게 바로 올해입니다.
올해부터 5년간 우리가 지금까지 겪어보지 못했던 극심한 청년 실업문제가 나올 겁니다.

네 번째로는 인구절벽입니다.
올해 처음으로 생산가능인구가 감소합니다.
생산가능인구라고 함은 15세부터 64세, 경제활동을 열심히 하는 주축 연령의 분들을 총합계를 낸 겁니다.
올해 지금까지 처음 겪는 감소가 시작되는 겁니다.

일본의 예를 보면, 일본이 생산가능인구 감소가 시작되면서, 모든 경제지표가 감소하면서 20년 장기불황이 이어졌던 예가 있습니다.
우리나라가 그게 올해부터 실현되는 겁니다.

마지막으로 외교절벽입니다.
미국의 도널드 트럼프 대통령부터 해서 우리나라 주위를 둘러싼 4대 강국들의 동향이 심상치가 않습니다.
전부 자국 보호무역주의 진행하고 있습니다.
아마도 무역부분에 대해서 더 힘든 상황들이 앞으로 전개될 겁니다.

지금 대한민국이 처해있는 상황은 5대 절벽 낭떠러지 끝에 서있다고 말씀 드리고 있습니다.
수출절벽, 내수절벽, 일자리절벽, 인구절벽, 그리고 외교절벽이 우리가 지금 당장 해결해야 될 과제입니다.

그런데 우리 바로 앞에 놓여진 난관이 하나 더 있습니다.
그게 4차 산업혁명입니다.
아마도 여기 계신 모든 대표자분들께서 가장 관심을 많이 기울이실 거라고 생각합니다.
왜냐하면 일자리의 근본적인 변화가 우리 앞에 놓여있는 겁니다.

이 문제를 풀기 위해서는 많은 현장에서 일하시는 여기 계신 많은 대표자분들과 함께 정치권에서 앞을 내다보고 미래를 준비하는 것이 절실합니다.
그래야만 위기를 극복할 수 있다고 봅니다.

거기에 대해서 저는 여러 가지 정책들을 이미 입법화하고 있고, 여러 토론회 기회를 통해 많은 말씀들을 드린 바 있습니다.
제가 2월 한달만해도 한 시간 이상의 토론프로그램에 10회 이상 출연했습니다.
관심 있으신 분들 다시보기를 해보시면 제가 각각의 분야에 대해서 교육은 어떻게 개혁을 해야 되고, 경제 분야는 어떻게 개혁해야 되며, 과학기술분야는 어떻게 해야 되는지 그런 내용들을 아실 수 있을 겁니다.

오늘 여러 가지 현장에서 느끼고 있는 말씀들 주시면 제대로 반영해서 문제 해결하는 정책들 꼭 만들겠습니다.

감사합니다.",2017-03-03T08:20:32+0000,photo,https://www.facebook.com/ahncs111/photos/a.232039820271389.1073741830.228389347303103/912773658864665/?type=3,228389347303103_912775815531116,안철수 added 2 new photos.,190,13,4
228389347303103,안철수,"(의원실)
안철수 전 대표가 잠시 후 오후 6시 ‘중앙일보 논설위원실 페이스북 라이브’에 생방송 출연합니다.
많은 관심과 시청 바랍니다.
중앙일보 논설위원실 페이스북 : 
https://www.facebook.com/pg/joongangopinion/posts/?ref=page_internal",2017-03-03T07:32:33+0000,photo,https://www.facebook.com/ahncs111/photos/a.232039820271389.1073741830.228389347303103/912758532199511/?type=3,228389347303103_912758532199511,NA,180,13,10
228389347303103,안철수,"어제 사연 공모를 시작한다고 알려드린 <안철수, 사람들> 프로젝트 페이지에 벌써 첫 사연이 올라왔습니다.
37세의 평범한 회사원이자 두 아들의 아버지인 분의 사연입니다.

힘든 세상 속에서도 꿋꿋이 사랑하는 사람들을 위해, 이 세상을 위해 소중한 가치를 포기하지 않으며 살아가는 이런 분들의 이야기는 늘 우리에게 큰 힘이 됩니다.
이런 진솔한 응원의 목소리에 저 역시 늘 가슴이 뜨거워집니다.

<안철수, 사람들>에 여러분들의 많은 사연이 공유될 수 있기를 바랍니다.
매일을 버텨내는 우리의 힘은 다름 아닌 우리들의 살아가는 이야기입니다.

참, 사연은 이메일 접수 이외에도 <안철수, 사람들> 페이지의 메시지로 손쉽게 보내실 수 있다고 합니다.",2017-03-03T06:47:58+0000,photo,https://www.facebook.com/ahnpeople/photos/a.390511017980659.1073741828.390508084647619/390930087938752/?type=3,228389347303103_912745615534136,"안철수 shared 안철수, 사람들's photo.",205,15,0
228389347303103,안철수,"노력하는 모습이 아름다운 천정배 전 대표의 랩 영상입니다.
정말 직접 랩을 하시는 영상입니다.
저도 분발해야겠습니다.
https://youtu.be/PvDk9rCQzHU",2017-03-03T05:38:39+0000,video,https://youtu.be/PvDk9rCQzHU,228389347303103_912709092204455,NA,283,29,9
228389347303103,안철수,"“당신들이 그의 정치에 동의하지 못하면, 그는 정치인이고, 당신들이 그의 정치에 동의하면 그는 위대한 정치가입니다.
정치인은 다음 선거를 생각하고, 위대한 정치가는 다음 세대를 생각합니다.”
3월 2일, 외신기자클럽 초청 토론회 기조연설 전문입니다.
<‘평화로운 한반도’를 위한 한국의 전략>
https://goo.gl/VDP3bQ",2017-03-03T05:10:14+0000,link,https://goo.gl/VDP3bQ,228389347303103_912693515539346,NA,551,37,20
228389347303103,안철수,"3월 2일, 외신기자클럽 초청 토론회에 참석해 <‘평화로운 한반도’를 위한 한국의 전략> 기조연설을 진행하고, 외교, 안보, 남북관계 분야에서 추구하는 다섯 가지 정책목표와 그것들을 성취하기 위한 세 가지 전략을 말씀드렸습니다.
한글 자막을 첨부한 머니투데이 영상 공유합니다.
https://youtu.be/pOAjPFLGag0",2017-03-03T03:38:39+0000,video,https://youtu.be/pOAjPFLGag0,228389347303103_912653592210005,NA,242,8,27
228389347303103,안철수,"(의원실)
“지나온 길은 한 사람의 모든 것입니다.
삶에서 어떤 길을 선택하였고 얼마나 충실하였는가가 그 사람의 업적으로 나타납니다.
지금까지의 업적도 충분히 칭찬 받을 만하지만 정말 무서운 건 안철수는 계속 배우고 나아진다는 겁니다.
안철수는 인생 자체가 도전이고 배움이고 발전의 연속입니다.
걸어온 길은 나눔과 베품과 희생과 나아짐입니다.
본인 스스로는 충실하게 발전하면서 늘 사회와 주변에 막대한 영향력을 남겨온 사람입니다.”

트위터 David Choi‏ @ibreakthrough11 님이 쓴 안철수 이야기 공유합니다.",2017-03-03T02:45:46+0000,photo,https://www.facebook.com/ahncs111/photos/a.232039820271389.1073741830.228389347303103/912631895545508/?type=3,228389347303103_912631895545508,NA,277,15,14
228389347303103,안철수,"(의원실)
안철수 전 대표 3월 5일(일) 일정입니다.
11:00 창의교육실현 코딩 수업 현장 방문 / 핸즈온캠퍼스 (서울 용산구 전자랜드)
18:30 채널A <청년, 대선주자에게 길을 묻다> 녹화",2017-03-04T10:30:31+0000,photo,https://www.facebook.com/ahncs111/photos/a.232039820271389.1073741830.228389347303103/913456422129722/?type=3,228389347303103_913456422129722,NA,271,40,22
228389347303103,안철수,"[‘부산 학부모와의 교육 간담회’ 강연]
@부산 해운대구 문화복합센터 (2017.03.04.)

제가 오늘 말씀드릴 내용은 크게 두 가지입니다.
첫 번째는 4차 산업혁명이란 무엇인가. 그 다음 두 번째는 거기에 맞춰서 교육이 어떻게 변화해야 되는가라는 두 가지 주제에 걸쳐서 말씀 드리겠습니다.

4차 산업혁명은 여러 가지가 다릅니다.
한마디로 융합혁명이 4차 산업혁명입니다.

그 문제에 대해서는 제가 누구보다도 전문성이 있습니다.
정치하기 전에 제가 했던 일이 서울대학교 융합과학기술대학원 원장이었습니다.
그래서 융합에 대해서 앞서서 전문성을 가지고 있는데, 이 4차 산업혁명이 바로 융합혁명이기 때문에 제가 거기에 대해서는 충분히 말씀 드릴 수 있다고 봅니다.

뭐가 틀린가, 3가지가 틀립니다.
우선 첫 번째 지금까지 1차, 2차, 3차는 한 가지 기술에 의한 혁명이었습니다.
1차 증기기관, 2차 전기, 3차 IT기술, 컴퓨터입니다.
한 가지가 세상을 바꾸니까 미래가 어떻게 전개될지 예측이 가능했습니다.

4차 산업혁명은 다릅니다.
4차는 한 가지 기술이 아니라 수많은 첨단기술들이 동시에 발전하면서 우리가 예상하지 못하는 기술들끼리 합쳐지는 겁니다.
융합이라는 게 합쳐지는 거 아닙니까. 그래서 저는 융합혁명이라고 말씀 드리는 겁니다.

그런데 이 특징은 미래에 대한 예측이 불가능합니다.
자동차 기술이 발달하고 있었습니다.
그런데 또 한편에서는 인공지능이 발달하고 있었습니다.
그런데 우리가 이 둘이 합쳐져서 자율주행 자동차가 탄생할거라고는 사람들이 잘 몰랐습니다.
이런 식으로 되는 겁니다.
그러니까 미래에 대한 예측이 불가능하다는 말씀을 드리고 싶습니다.

그 다음에, 세 번째로 중요한 점은 일자리와 관련해서 그 영향력이 엄청나다는 겁니다.
제가 2년 전 독일에 갔습니다.
그 당시 대표적인 4차 산업혁명과 연관된 공장이 있다고 해서 직접 보러 갔습니다.
갔더니 축구장보다도 훨씬 더 큰데 사람이 없는 겁니다.
생산하는 쪽에서는 로봇이 생산하고 있고, 필요한 부품들은 전부 무인 자동차가 사물 인터넷에 연결돼서 필요한 곳에 필요한 부품들을 실어 나르고 있는 겁니다.
그게 우리나라에 곧 닥칠 미래의 모습입니다.

제조업 일자리가 엄청나게 줄어들 겁니다.
그런데 제조업 일자리 뿐만 아닙니다.
작년 가을인가요. 아마 신문기사 보신 분들 있으실 겁니다. 영화 예고편 만드는 기사였습니다.
보통 영화예고편을 어떻게 만드는 가 봤더니, 영화감독이 영화를 찍은 다음에 그걸 가지고 2시간짜리 가편집본을 만들지 않습니까. 그러면 그걸 가지고 전문가팀이 모여 한 달 정도를 작업을 하면 2-3분짜리 영화예고편을 만들 수 있답니다.
한 달 정도 걸린답니다.

그런데 작년에 IBM회사에서 왓슨이라는 인공지능 컴퓨터가 나왔습니다.
예전부터 있었습니다만, 그걸 가지고 영화 찍은 자료를 집어넣으면 하루 만에 자동으로 영화예고편이 만들어져 나오는 겁니다.

지금 인터넷에서 찾아보시면 인공지능이 만든 영화 예고편 바로 보실 수 있습니다.
그리고 사람이 만든 거하고 큰 차이가 없습니다.
정말 잘 만든 예고편입니다.

그러니까 4차 산업혁명 시대에는 제조업 일자리뿐만 아니라 전문가일자리까지도 엄청나게 줄어드는 겁니다.

지난 1차, 2차, 3차 혁명은 그렇지가 않았습니다.
그때는 사람을 도와서 한 사람이 많은 물건을 만들 수 있게 해줬습니다.
많은 물건들을 만들어서 회사가 돈을 많이 벌게 하니까 월급도 많이 받았습니다.
고급스러운 표현으로 말씀드리면, 1차, 2차, 3차 산업혁명은 노동자의 생산성을 향상시켜서 결국은 많은 보수를 받게 해주는 혁명이었습니다.
사람을 도와주는 혁명이었습니다.

그런데 4차 산업혁명은 일자리를 없애버려서 돈을 못 벌게 하는 겁니다.
이제 그런 점이 차이가 있는 겁니다.

그리고 마지막으로 교육과 관련된 가장 큰 차이점 중에 하나는 1, 2, 3차 때는 미래 예측이 가능했습니다.
그러면 필요한 인재상이 명확했습니다.
그래서 국가가 책임지고 한 방향으로 교육시키면 됐습니다.

그 교육과정을 거치면 아이들이 다 제대로 역할을 잘 하는 아이들인데, 4차 산업혁명시대에 그렇게 하면 오히려 아이들이 불행해집니다.
미래 예측이 가능하지 않는데, 국가에서 한 방향으로만 인재를 길렀다가 그 인재들이 필요 없어지는 상황이 오면 그 아이들은 어떻게 살아갑니까.

그러니까 지금은 미래예측이 불가능하고 미래에 필요한 인재상이 뭔지도 모르는 상황에서, 이제는 학교를 졸업한 아이들이 자기 스스로 불확실한 미래를 헤쳐 나가야 하는 겁니다.

거기서 필요한 것은 문제해결능력, 창의력, 그리고 인성, 적성 이런 부분들입니다.

교육의 기본으로 다시 돌아가야만 되는 상황입니다.

그래서 4차 산업혁명의 변화가 교육개혁의 가장 중요한 출발점이라는 말씀을 드리는 겁니다.

그러면 교육개혁을 도대체 어떤 방식으로 해야 하는가. 제가 생각하는 교육개혁은 3대 개혁방향에 있습니다.
우선 첫 번째, 정부조직이 바뀌어야 합니다.
지금 정부가 교육정책을 할 때 뭐가 문제냐. 두 가지가 문제입니다.

하나는 장관이 바뀌고 대통령이 바뀔 때마다 교육정책이, 입시제도가 바뀌는 겁니다.

두 번째는 정부가 주도해서 말을 잘 듣는 학교에만 자금 지원을 해주다 보니 창의교육을 아예 말살시킵니다.
창의 교육은 현장에서 알아서 하라고 자율성을 부여할 때만 스스로 노력해서 창의적인 교육이 가능해지는데, 국가가 미리 짜놓고 말 듣는 곳에만 자금을 지원해주다보면 창의교육이 아예 근본적으로 되지를 않습니다.
이 두 가지가 지금은 문제입니다.

그러면 이것을 어떻게 풀 것인가. 교육부를 없애야 합니다.
지금은 교육부가 아니고 ‘교육통제부’입니다.
그래서 창의교육이 불가능하게 만드는 겁니다.
완전히 거꾸로 역행하고 있습니다.

그래서 교육부는 없어져야 하는데, 그렇다고 정부가 손 떼고 무정부상태로 놔두자는 게 아닙니다.
오히려 재편해야 되는 거죠. 지금의 교육부 형태가 아니라 중장기적인 교육정책이 가능한, 대통령이 바뀌더라도 정책이 계속 똑같이 지속될 수 있는 그런 부서, 그게 ‘국가교육위원회’입니다.

그리고 그것을 정부에서는 앞에서 명령을 내리는 것이 아니라 지원만 해야 됩니다.
그게 ‘교육지원처’입니다.

즉 지금의 교육부를 폐지하고 ‘국가교육위원회’와 ‘교육지원처’로 만들어야 된다는 게 제 첫 번째 개혁과제입니다.

그러면 그게 왜 장기적인 정책이 가능해지는 구조인가. 국가교육위원회는 거기에 모든 이해관계자 대표가 다 모입니다.
학부모대표, 교육전문가들, 행정관료들, 여야정치권이 다 모여서 앞으로 10년 계획을 합의합니다.
사회적인 협약입니다.
다음 정부부터 아마도 우리나라는 사회협약이 굉장히 중요하게 될 겁니다.

그런데 첫 번째 모범사례를 국가교육위원회에서 만들 수 있다고 봅니다.

그렇게 해서 10년 계획을 합의를 하는데 그걸 매년 합니다.
올해 만약 그 위원회가 열리면 2027년까지 10년 계획을 합의합니다.
내년이 되면 2028년까지 합의를 하는 겁니다.
그러면 지금까지의 9년 합의 추가로 그 다음 1년을 추가로 합의하는 것 아닙니까. 그렇게 매년 10년 계획을 합의를 하면 100년 지속가능한 계획이 합의가 됩니다.

그리고 그건 사회적 합의이기 때문에 대통령이 바뀌어도 뒤집지 못하게 해야 합니다.
그러면 장관 바뀌고 대통령 바뀔 때마다 교육제도, 입시제도 바꾸는 일 막을 수 있습니다.

그리고 이제 정부가 시키는 일 하는 데만 돈 주는 것이 아니라, 교육지원처로 만들면 이제 지원만 해야 되는 겁니다.
그렇게 되면 일단은 창의적인 교육이 가능한 그런 구조가 될 수가 있는 겁니다.
정부차원에서 그렇습니다.

두 번째입니다. 학교는 어떻게 하는가. 지금 학교교육의 문제가 뭡니까.
초중고 12년 교육이, 12년 내내 대학입시 준비하는 기간이 되어버렸습니다.

그러니까 어떤 교육개혁도 소용이 없는 겁니다.
무슨 소프트웨어 교육하고, 자유학기제 도입하고, 여러 노력 있었습니다만 전부 실패했습니다.

그래서 이제는 특단의 대책이 필요한 때가 왔습니다.
그게 뭐냐, 학제개편입니다.
지금의 초중고 6-3-3 제도가 아니라, 이것을 완전히 근본적으로 분리해야 합니다.
그래서 입시제도와 학제를 분리하게 되면 어떻게 되는가. 이제야말로 창의교육이 가능해지고, 적성을 찾을 수 있고, 아이들의 인성교육이 가능해지고, 사교육비가 줄 수 있습니다.

어떻게 하면 되는 것인가. 지금은 만5세 정도에 유치원을 다니고 만6세부터 초등학교를 다니지 않습니까. 이걸 바꾸는 겁니다.
공교육으로 만3세부터 5세까지 유치원을 다니게 합니다.
지금의 유치원과 초등학교 4학년까지의 5년 동안을 초등학교로 만드는 겁니다.
그러면 만 5세부터 10세까지 초등학교를 다니면서 정말 기본적인 인성교육, 소양교육을 하게 됩니다.

그 다음에 지금의 초등학교 5, 6학년과 중학교 1, 2,3 학년을 합친 5년을 중등학교에서 보통교육을 받게 합니다.
조금 더 심화돼서 우리 자유민주주의 국가에서 시민으로서 역할을 할 수 있는 보통교육을 그때 받게 됩니다.

만 15세가 되면 두 가지 선택 중에 한 곳을 갑니다.
하나는 2년 과정의 진로탐색학교를 갑니다.
거기서는 학점제로 운영이 됩니다.
그래서 거기서 지금 학교에서 배우는 과목을 배워도 되고, 다른 주위에 있는 학교에 가서 배워도 학점으로 인정받고, 대학과목도 자기가 능력 있으면 들을 수 있습니다.
이미 미국에서 AP라는 형태로 고등학생들이 수업을 받고 있습니다.

그렇게 해서 학교를 졸업합니다.
거기서는 지금의 수능 같은 시험은 자격고사 형태로 일정 기준만 통과되면 다 대학에 갈 수 있도록 하고, 대학입시는 거기에 맞게 학생부전형과 유사한 형태로 해서 자기가 원하는 대학에 갈 수 있도록 하는 겁니다.

그 길이 하나 있고, 또 다른 길은 직업학교를 가는 겁니다.
2년제의 직업학교입니다.
만15세에 입학해서 만17세에 졸업합니다.
그래서 직업학교, 지금의 마이스터고와 유사한 과정을 거친 다음에 직장으로 가게 됩니다.

그렇다고 완전히 그걸로 나누는 건 아닙니다.
직장을 가서도 어느 정도 기간이 지나면 대학에 입학하는 자격고사는 면제를 받습니다.
그리고 대학도 지금보다는 평생교육 형태로 운영이 됩니다.
그게 제가 생각하는 전체적인 학제개편의 구상입니다.

더 세부적인 사항이 많습니다만, 여기서 꼭 필요한 것은 학제개편 자체가 목적이 아니고, 어떻게 하면 입시교육과 보통교육을 분리해서 자라나는 아이들이 적성을 찾고, 인성교육을 받고, 창의교육을 받아서, 문제해결능력을 키울 수 있을지에 대한 고민이 담겨 있는 겁니다.

세 번째입니다. 대학 졸업하고 나면 국가가 교육에서 손을 뗍니다.
근데 이거 비정상적인 형태인거 아십니까. 선진국들을 보면 학교 졸업한 다음에도 중년층, 장년층, 노년층 교육, 한마디로 평생교육을 국가에서 책임집니다.
선진국들 보면 전체 교육 예산 중에 7% 정도 평생교육에 쓰고 있습니다.

대한민국은 어느 정돈가, 저는 처음보고 놀랐습니다.
우리나라는 평생교육에 쓰는 예산이 전체교육 예산의 0.07%를 씁니다.
100분의 1이라는 게 말이 됩니까.
거의 완전히 버려둔 겁니다.
국가가 직무유기하고 있는 겁니다.

그런데 지금까지 그래왔지만 이제는 그러면 안 됩니다.
왜냐하면 4차 산업혁명시대는 끊임없이 자기 전문성을 유지하기 위해서도, 다른 직업으로 옮기기 위해서도 교육을 받아야 됩니다.

그건 국가에서 책임져야 하는 겁니다.
그래서 다음 정부는 반드시 평생교육을 강화하는 방향으로 교육개혁이 일어나야 합니다.

요약해서 말씀 드리겠습니다.
제가 생각하는 교육의 3대 개혁 방향은 첫 번째로 정부조직을 바꾸는 겁니다.
교육부를 폐지하고 ‘국가교육위원회’를 통해서 장기적인 교육정책이 가능하도록 하고, ‘교육지원처’를 통해서 정부가 지원하는 형태로 가는 겁니다.

두 번째로는 학제개편을 통해서 이제는 초중고 대학교까지 창의교육이 가능한 형태로 만드는 겁니다.

세 번째로는 학교 졸업한 이후에 평생교육도 정부가 혁명적으로 강화하는 게 제가 가진 기본적인 방향입니다.

이 정도로 제 내용은 마치고 대화의 시간을 가지면 좋겠습니다.

고맙습니다.",2017-03-04T07:28:15+0000,photo,https://www.facebook.com/ahncs111/photos/a.232039820271389.1073741830.228389347303103/913384075470290/?type=3,228389347303103_913385042136860,안철수 added 2 new photos.,329,36,58
228389347303103,안철수,"(의원실)
안철수 전 대표는 KTX에서 무엇을 할까요?
모자란 잠을 잘까요? 책을 볼까요?
의원실에서 전해드리는 안철수 비하인드 영상,
'대구 가는 길'입니다.
(지난 2월 24일, 대구 행 KTX에서)",2017-03-04T05:37:07+0000,video,https://www.facebook.com/ahncs111/videos/913331688808862/,228389347303103_913331688808862,NA,542,51,43
228389347303103,안철수,"(의원실)
안철수 전 대표 3월 6일(월) <강원도> 일정입니다.
09:00 전국순회 최고위원회의 / 춘천시의회
10:00 강원도지사 차담 / 강원도청
10:20 강원도 정책간담회 / 강원도청
11:20 강원 지역 기자 간담회 / 강원도청
15:40 안철수 의원과 함께하는 직장맘, 육아맘과의 대화 / 쿱드림 까페, 강원도 원주시",2017-03-05T10:13:27+0000,photo,https://www.facebook.com/ahncs111/photos/a.232039820271389.1073741830.228389347303103/914042782071086/?type=3,228389347303103_914042782071086,NA,266,38,16
